resume_id,address,career_objective,skills,educational_institution_name,degree_names,passing_years,educational_results,result_types,major_field_of_studies,professional_company_names,company_urls,start_dates,end_dates,related_skils_in_job,positions,locations,extra_curricular_activity_types,extra_curricular_organization_names,extra_curricular_organization_links,role_positions,languages,proficiency_levels,certification_providers,certification_skills,online_links,issue_dates,expiry_dates,resume_text
88,,,"['Machine Learning Engineer', 'Data Processing', 'Data Modelling', 'Data Structures', 'Deep Learning', 'Application Development', 'Python', 'Django', 'Flask', 'Kubernetes', 'C++']","['SHRI GURU GOBIND SINGHJI COLLEGE OF ENGINEERING AND TECHNOLOGY, NANED']",['B.TECH'],['2019'],[None],[None],['COMPUTERS'],"['TATA CONSULTANCY SERVICES LTD.', 'NANYANG TECHNOLOGICAL UNIVERSITY']","[None, None]","['SEP 2019', 'SEP 2018']","['TILL DATE', None]","[['Algorithm engineer', 'solution developer'], ['Developed positioning system']]","['MACHINE LEARNING ENGINEER', 'RESEARCH ASSISTANT']","['N/A', 'N/A']",['Competition'],['BITS GOA'],[None],"['RUNNER-UP, SOLINOVATE']",,,,,,,,"nan nan ['Machine Learning Engineer', 'Data Processing', 'Data Modelling', 'Data Structures', 'Deep Learning', 'Application Development', 'Python', 'Django', 'Flask', 'Kubernetes', 'C++'] ['SHRI GURU GOBIND SINGHJI COLLEGE OF ENGINEERING AND TECHNOLOGY, NANED'] ['B.TECH'] ['2019'] [None] [None] ['COMPUTERS'] ['TATA CONSULTANCY SERVICES LTD.', 'NANYANG TECHNOLOGICAL UNIVERSITY'] [None, None] ['SEP 2019', 'SEP 2018'] ['TILL DATE', None] [['Algorithm engineer', 'solution developer'], ['Developed positioning system']] ['MACHINE LEARNING ENGINEER', 'RESEARCH ASSISTANT'] ['N/A', 'N/A'] ['Competition'] ['BITS GOA'] [None] ['RUNNER-UP, SOLINOVATE'] nan nan nan nan nan nan nan"
89,,,"['budgeting', 'CAD', 'construction management', 'engineer', 'film', 'hiring', 'inspection', 'laser', 'machinery', 'managing', 'mechanical', 'negotiations', 'processes', 'process improvement', 'project management', 'quality', 'simulation', 'SPC', 'strategy', 'supervision', 'system administrator', 'Paper converting equipment', 'Facility and plant modifications', 'DMF and Project Work Process', 'Written and verbal communication skills', 'AutoCAD', 'Excel']",['University of Idaho - School of Engineering'],['Bachelor of Science'],['N/A'],['N/A'],['N/A'],['Mechanical Engineering'],"['Company Name', 'Company Name', 'Company Name', 'Company Name', 'Company Name', 'Company Name', 'Company Name']","[None, None, None, None, None, None, None]","['May 2011', 'January 2009', 'November 2005', 'November 2000', 'January 1993', 'November 1992', 'January 1984']","['Current', 'May 2011', 'January 2009', 'November 2005', 'November 2000', 'January 1993', 'November 1992']","[['project management', 'capital projects', 'engineering talent', 'venture summaries', 'hiring'], ['safe work performance', 'contract adherence', 'maintenance group', 'lubrication', 'precision maintenance work', 'sustainable PM processes', 'BOMs', 'procedure based job plans'], ['PM program', 'mechanical work standards', 'job plan library', 'CMMS', 'RCM methodology', 'CMMS system administration', 'tools development', 'PM processes'], ['laser patterning', 'lamination process', 'web handling', 'SPC strategy', 'GR&R practices', 'adhesive improvement', 'task force leadership'], ['budgeting', 'capital improvement', 'construction management', 'vendor negotiations', 'installation and startup', 'project management'], ['utilization improvement plans'], ['design engineer', 'machinery development', 'equipment layouts', 'CAD installation', 'simulation models']]","['Engineering Manager', 'Manager - Maintenance and Reliability', 'Supervisor Reliability Engineer', 'Process & Tooling Engineer', 'Converting Plant Engineer', 'Senior Converting Analyst', 'Development Designer, Mechanical Engineer, Senior Mechanical Engineer']","['City , State', 'City , State', 'City , State', 'City , State', 'City , State', 'City , State', 'City , State']",,,,,,,,,,,,"nan nan ['budgeting', 'CAD', 'construction management', 'engineer', 'film', 'hiring', 'inspection', 'laser', 'machinery', 'managing', 'mechanical', 'negotiations', 'processes', 'process improvement', 'project management', 'quality', 'simulation', 'SPC', 'strategy', 'supervision', 'system administrator', 'Paper converting equipment', 'Facility and plant modifications', 'DMF and Project Work Process', 'Written and verbal communication skills', 'AutoCAD', 'Excel'] ['University of Idaho - School of Engineering'] ['Bachelor of Science'] ['N/A'] ['N/A'] ['N/A'] ['Mechanical Engineering'] ['Company Name', 'Company Name', 'Company Name', 'Company Name', 'Company Name', 'Company Name', 'Company Name'] [None, None, None, None, None, None, None] ['May 2011', 'January 2009', 'November 2005', 'November 2000', 'January 1993', 'November 1992', 'January 1984'] ['Current', 'May 2011', 'January 2009', 'November 2005', 'November 2000', 'January 1993', 'November 1992'] [['project management', 'capital projects', 'engineering talent', 'venture summaries', 'hiring'], ['safe work performance', 'contract adherence', 'maintenance group', 'lubrication', 'precision maintenance work', 'sustainable PM processes', 'BOMs', 'procedure based job plans'], ['PM program', 'mechanical work standards', 'job plan library', 'CMMS', 'RCM methodology', 'CMMS system administration', 'tools development', 'PM processes'], ['laser patterning', 'lamination process', 'web handling', 'SPC strategy', 'GR&R practices', 'adhesive improvement', 'task force leadership'], ['budgeting', 'capital improvement', 'construction management', 'vendor negotiations', 'installation and startup', 'project management'], ['utilization improvement plans'], ['design engineer', 'machinery development', 'equipment layouts', 'CAD installation', 'simulation models']] ['Engineering Manager', 'Manager - Maintenance and Reliability', 'Supervisor Reliability Engineer', 'Process & Tooling Engineer', 'Converting Plant Engineer', 'Senior Converting Analyst', 'Development Designer, Mechanical Engineer, Senior Mechanical Engineer'] ['City , State', 'City , State', 'City , State', 'City , State', 'City , State', 'City , State', 'City , State'] nan nan nan nan nan nan nan nan nan nan nan"
90,,"I'm passionate learner with a knack for Artificial Intelligence. The kind of problems AI can solve, fills me with enthusiasm to learn more and contribute more. I have dedicated more than a year developing and training Machine learning Models across several projects.","['Data Science', 'Data Analysis', 'Deep Learning', 'Machine Learning', 'Artificial Intelligence', 'Python', 'MATLAB', 'NLP', 'Computer Vision', 'Keras', 'Pytorch', 'RNN']","['IIT Kharagpur', 'IIT Kharagpur']","['B.Tech', 'M.Tech']","['2017', '2019']","['N/A', 'N/A']","['N/A', 'N/A']","['N/A', 'N/A']",['IIT Labs'],['N/A'],['May 2019'],['till date'],"[['Artificial Intelligence', 'Machine Learning', 'Publication', 'Model Development', 'Model Tuning']]",['Associate Researcher'],['N/A'],['Developer'],['Pytorch Academy'],['N/A'],['PyTorch Developer'],,,,,,,,"nan I'm passionate learner with a knack for Artificial Intelligence. The kind of problems AI can solve, fills me with enthusiasm to learn more and contribute more. I have dedicated more than a year developing and training Machine learning Models across several projects. ['Data Science', 'Data Analysis', 'Deep Learning', 'Machine Learning', 'Artificial Intelligence', 'Python', 'MATLAB', 'NLP', 'Computer Vision', 'Keras', 'Pytorch', 'RNN'] ['IIT Kharagpur', 'IIT Kharagpur'] ['B.Tech', 'M.Tech'] ['2017', '2019'] ['N/A', 'N/A'] ['N/A', 'N/A'] ['N/A', 'N/A'] ['IIT Labs'] ['N/A'] ['May 2019'] ['till date'] [['Artificial Intelligence', 'Machine Learning', 'Publication', 'Model Development', 'Model Tuning']] ['Associate Researcher'] ['N/A'] ['Developer'] ['Pytorch Academy'] ['N/A'] ['PyTorch Developer'] nan nan nan nan nan nan nan"
91,,,"['Project Management', 'Quality Management System Implementation', 'Production and Engineering Management', 'Staff development', 'Cost reduction', 'Process development and documentation', 'Process improvement/simplification', 'Source evaluation and selection', 'Experience with AutoCAD', 'Microsoft Office', 'Various ERP systems', 'ISO9001 and AS9100 auditing']",['Rose-Hulman Institute of Technology'],['Bachelor of Science'],['1978'],['N/A'],['N/A'],['Mechanical Engineering'],"['Company Name', 'Company Name']","[None, None]","['May 2000', 'April 1980']","['December 2015', 'May 2000']","[['Project Management', 'Quality Management System Implementation', 'Production and Engineering Management', 'Staff development', 'Cost reduction', 'Process development and documentation', 'Process improvement/simplification', 'Source evaluation and selection'], ['Project Management', 'Quality Management System Implementation', 'Production and Engineering Management', 'Staff development', 'Cost reduction', 'Process development and documentation', 'Process improvement/simplification', 'Source evaluation and selection']]","['Engineering Manager/Quality Manager', 'Manufacturing Engineer, Project Engineer, Sales Engineer, Product Development Engineer, and Manufacturing Engineering Manager']","['DeLand, FL', 'City, State']",,,,,,,,,,,,"nan nan ['Project Management', 'Quality Management System Implementation', 'Production and Engineering Management', 'Staff development', 'Cost reduction', 'Process development and documentation', 'Process improvement/simplification', 'Source evaluation and selection', 'Experience with AutoCAD', 'Microsoft Office', 'Various ERP systems', 'ISO9001 and AS9100 auditing'] ['Rose-Hulman Institute of Technology'] ['Bachelor of Science'] ['1978'] ['N/A'] ['N/A'] ['Mechanical Engineering'] ['Company Name', 'Company Name'] [None, None] ['May 2000', 'April 1980'] ['December 2015', 'May 2000'] [['Project Management', 'Quality Management System Implementation', 'Production and Engineering Management', 'Staff development', 'Cost reduction', 'Process development and documentation', 'Process improvement/simplification', 'Source evaluation and selection'], ['Project Management', 'Quality Management System Implementation', 'Production and Engineering Management', 'Staff development', 'Cost reduction', 'Process development and documentation', 'Process improvement/simplification', 'Source evaluation and selection']] ['Engineering Manager/Quality Manager', 'Manufacturing Engineer, Project Engineer, Sales Engineer, Product Development Engineer, and Manufacturing Engineering Manager'] ['DeLand, FL', 'City, State'] nan nan nan nan nan nan nan nan nan nan nan"
92,,Currently seeking the next career challenge of continuing the path of accounting management in a small to medium-sized company that needs an involved professional with demonstrated leadership experience.,"['Proactive', 'self-motivated', 'team player', 'AP', 'AR', 'bank reconciliations', 'billings', 'budgets', 'cash flow projections', 'government contracting', 'financial statements', 'Quickbooks', 'Peachtree', 'JDE', 'Great Plains', 'LabView', 'Matlab', 'Access', 'Excel', 'Word']","['University of Maryland, University College', 'University of Maryland', 'University of Maryland']","['Master of Science', 'M. Eng', 'Bachelor of Science']","['2012', '2001', 'N/A']","['N/A', 'N/A', 'N/A']","['N/A', 'N/A', 'N/A']","['Accounting and Finance', 'Aerospace Engineering', 'Aerospace Engineering']","['Company Name', 'Company Name', 'Company Name', 'Company Name']","[None, None, None, None]","['August 2011', 'July 2006', 'July 1995', 'January 1992']","['Current', 'August 2011', 'July 2006', 'July 1995']","[['financial integration', 'problem-solving', 'project management', 'mentoring'], ['accounting system', 'Quickbooks Pro', 'financial audit', 'staff supervision'], ['simulation tool', 'US Navy analysis', 'technical proposal writing'], ['sensing and actuator technologies', 'DARPA project', 'engineering project management']]","['Engineering Supervisor', 'Vice President', 'Assistant Program Manager', 'Project Engineer']","['City, State', 'City, State', 'City, State', 'City, State']",['Affiliation'],['American Institute of Certified Public Accountants (AICPA)'],[None],['N/A'],,,['CPA'],[None],[None],['2013'],[None],"nan Currently seeking the next career challenge of continuing the path of accounting management in a small to medium-sized company that needs an involved professional with demonstrated leadership experience. ['Proactive', 'self-motivated', 'team player', 'AP', 'AR', 'bank reconciliations', 'billings', 'budgets', 'cash flow projections', 'government contracting', 'financial statements', 'Quickbooks', 'Peachtree', 'JDE', 'Great Plains', 'LabView', 'Matlab', 'Access', 'Excel', 'Word'] ['University of Maryland, University College', 'University of Maryland', 'University of Maryland'] ['Master of Science', 'M. Eng', 'Bachelor of Science'] ['2012', '2001', 'N/A'] ['N/A', 'N/A', 'N/A'] ['N/A', 'N/A', 'N/A'] ['Accounting and Finance', 'Aerospace Engineering', 'Aerospace Engineering'] ['Company Name', 'Company Name', 'Company Name', 'Company Name'] [None, None, None, None] ['August 2011', 'July 2006', 'July 1995', 'January 1992'] ['Current', 'August 2011', 'July 2006', 'July 1995'] [['financial integration', 'problem-solving', 'project management', 'mentoring'], ['accounting system', 'Quickbooks Pro', 'financial audit', 'staff supervision'], ['simulation tool', 'US Navy analysis', 'technical proposal writing'], ['sensing and actuator technologies', 'DARPA project', 'engineering project management']] ['Engineering Supervisor', 'Vice President', 'Assistant Program Manager', 'Project Engineer'] ['City, State', 'City, State', 'City, State', 'City, State'] ['Affiliation'] ['American Institute of Certified Public Accountants (AICPA)'] [None] ['N/A'] nan nan ['CPA'] [None] [None] ['2013'] [None]"
93,,"Fresher with excellent communication, good analyzing, and problem-solving skills. Proficient and well-armed at Debugging and Bug fixing. Strong C, C++ coding background and well informed in OOPs concepts.","['Embedded Software Development', 'Embedded Systems', 'Project Management', 'Chain Management', 'Defect Detection', 'Machine Learning', 'Unit Testing']",['Manipal University'],['B.Tech'],['2021'],['N/A'],['N/A'],['Electronics'],['Titli Foundation'],['N/A'],['Jun 2020'],['Dec 2020'],[None],['System Developer'],['N/A'],['Elocution'],['College'],['N/A'],['Best College Elocutioner'],,,,,,,,"nan Fresher with excellent communication, good analyzing, and problem-solving skills. Proficient and well-armed at Debugging and Bug fixing. Strong C, C++ coding background and well informed in OOPs concepts. ['Embedded Software Development', 'Embedded Systems', 'Project Management', 'Chain Management', 'Defect Detection', 'Machine Learning', 'Unit Testing'] ['Manipal University'] ['B.Tech'] ['2021'] ['N/A'] ['N/A'] ['Electronics'] ['Titli Foundation'] ['N/A'] ['Jun 2020'] ['Dec 2020'] [None] ['System Developer'] ['N/A'] ['Elocution'] ['College'] ['N/A'] ['Best College Elocutioner'] nan nan nan nan nan nan nan"
94,,,"['Army', 'basic', 'bridges', 'inspection', 'Inspects', 'Marconi', 'Office', 'Radar', 'multi-meters', 'oscilloscopes', 'personnel', 'radio', 'Read', 'Safety', 'signal generators', 'Telephone', 'troubleshooting', 'VHF']","['University of *Strong Vincent HS', 'Intermediate Electronic Principles, Keesler AFB, MS', '*Telephone Central Office Repair', '*HAZMAT Familiarization/Safety Transport', '*Forward Area Alerting Radar Repairer']","['Diploma', 'N/A', 'N/A', 'N/A', 'N/A']","['2001', '2010', '1987', '2007', '1990']","['N/A', 'N/A', 'N/A', 'N/A', 'N/A']","['N/A', 'N/A', 'N/A', 'N/A', 'N/A']","['N/A', 'N/A', 'N/A', 'N/A', 'N/A']","['Company Name', 'Company Name', 'Company Name']","[None, None, None]","['January 2012', 'January 2000', 'January 1992']","['January 2013', 'Current', 'January 2000']","[['Supervised construction', 'Read and interpret construction drawings', 'Estimate material, time, labor, and equipment', 'Inspect structures'], ['Circuit analysis', 'Complex test instruments', 'Engineering tools'], ['Circuit analysis', 'Complex test instruments', 'Engineering tools']]","['Construction Engineering Supervisor', 'Combat Engineer', 'Combat Engineer']","['City, State', 'City, State', 'N/A']",,,,,,,,,,,,"nan nan ['Army', 'basic', 'bridges', 'inspection', 'Inspects', 'Marconi', 'Office', 'Radar', 'multi-meters', 'oscilloscopes', 'personnel', 'radio', 'Read', 'Safety', 'signal generators', 'Telephone', 'troubleshooting', 'VHF'] ['University of *Strong Vincent HS', 'Intermediate Electronic Principles, Keesler AFB, MS', '*Telephone Central Office Repair', '*HAZMAT Familiarization/Safety Transport', '*Forward Area Alerting Radar Repairer'] ['Diploma', 'N/A', 'N/A', 'N/A', 'N/A'] ['2001', '2010', '1987', '2007', '1990'] ['N/A', 'N/A', 'N/A', 'N/A', 'N/A'] ['N/A', 'N/A', 'N/A', 'N/A', 'N/A'] ['N/A', 'N/A', 'N/A', 'N/A', 'N/A'] ['Company Name', 'Company Name', 'Company Name'] [None, None, None] ['January 2012', 'January 2000', 'January 1992'] ['January 2013', 'Current', 'January 2000'] [['Supervised construction', 'Read and interpret construction drawings', 'Estimate material, time, labor, and equipment', 'Inspect structures'], ['Circuit analysis', 'Complex test instruments', 'Engineering tools'], ['Circuit analysis', 'Complex test instruments', 'Engineering tools']] ['Construction Engineering Supervisor', 'Combat Engineer', 'Combat Engineer'] ['City, State', 'City, State', 'N/A'] nan nan nan nan nan nan nan nan nan nan nan"
95,,,"['New Business Development', 'Pricing Proposal Development', 'P & L Management', 'Customer Relationship Management', 'Strategic Planning', 'Key Account Management', 'Contract Negotiations', 'NPI/JDM/ODM', 'Financials Budgeting & Forecasting', 'Sales', 'PCB', 'Account Management', 'Customer Service']",['California University'],['Bachelor of Science'],['N/A'],['N/A'],['N/A'],['Industrial Education'],"['Company Name', 'Company Name', 'Company Name', 'Company Name']","[None, None, None, None]","['December 2007', 'December 2001', 'July 1991', 'May 1981']","['August 2014', 'December 2007', 'November 2001', 'May 1991']","[['Networking', 'Marketing Strategies', 'Vertical Market Growth', 'Aerospace and Defense Accounts', 'Customer Service'], ['Regional Sales Leadership', 'Customer Development', 'Financial Sales Targets'], ['Sales Strategy', 'Revenue Growth', 'Customer Forecast Planning'], ['Quality Assurance', 'Statistical Process Control', 'Procurement Strategy']]","['Director Business Development', 'Regional Account Manager', 'Director of Sales', 'Quality Manager']","['City, State', 'City, State', 'City, State', 'City, State']",,,,,,,['N/A'],[['CRM Training and Certification (SalesForce.com)']],[None],['N/A'],[None],"nan nan ['New Business Development', 'Pricing Proposal Development', 'P & L Management', 'Customer Relationship Management', 'Strategic Planning', 'Key Account Management', 'Contract Negotiations', 'NPI/JDM/ODM', 'Financials Budgeting & Forecasting', 'Sales', 'PCB', 'Account Management', 'Customer Service'] ['California University'] ['Bachelor of Science'] ['N/A'] ['N/A'] ['N/A'] ['Industrial Education'] ['Company Name', 'Company Name', 'Company Name', 'Company Name'] [None, None, None, None] ['December 2007', 'December 2001', 'July 1991', 'May 1981'] ['August 2014', 'December 2007', 'November 2001', 'May 1991'] [['Networking', 'Marketing Strategies', 'Vertical Market Growth', 'Aerospace and Defense Accounts', 'Customer Service'], ['Regional Sales Leadership', 'Customer Development', 'Financial Sales Targets'], ['Sales Strategy', 'Revenue Growth', 'Customer Forecast Planning'], ['Quality Assurance', 'Statistical Process Control', 'Procurement Strategy']] ['Director Business Development', 'Regional Account Manager', 'Director of Sales', 'Quality Manager'] ['City, State', 'City, State', 'City, State', 'City, State'] nan nan nan nan nan nan ['N/A'] [['CRM Training and Certification (SalesForce.com)']] [None] ['N/A'] [None]"
96,,"A challenging position in a Manufacturing, Engineering, or Research & Development environment where my overall technical background, along with my leadership and decision making capabilities will be combined to contribute to company goals, enlargement, & productivity.","['Data entry', 'Employee training', 'Equipment maintenance', 'ERP : Microsoft AX Dynamics', 'Failure analysis', 'Inspection', 'Lean manufacturing', 'Mechanical processes', 'protocols execution', 'Supervisory', 'System integration', 'Team player', 'Troubleshooting']",['East Boston High School'],['Diploma'],['1999'],[None],[None],[None],"['Company Name', 'Company Name', 'Company Name', 'Company Name', 'Company Name', 'Company Name']","[None, None, None, None, None, None]","['April 2015', 'February 2015', 'February 2004', 'September 1999', 'April 2003', 'March 2001']","['Current', 'April 2015', 'June 2014', 'January 2004', 'September 2003', 'January 2002']","[None, None, None, None, None, None]","['Engineering Technician', 'Sr. Repair Technician', 'Lead Manufacturing Technician Production Supervisor', 'Wafer Fab Technician', 'Assembler/Operator', 'Test Technician']","['City , State', 'City , State', 'City , State', 'City , State', 'City , State', 'City , State']",,,,,,,,,,,,"nan A challenging position in a Manufacturing, Engineering, or Research & Development environment where my overall technical background, along with my leadership and decision making capabilities will be combined to contribute to company goals, enlargement, & productivity. ['Data entry', 'Employee training', 'Equipment maintenance', 'ERP : Microsoft AX Dynamics', 'Failure analysis', 'Inspection', 'Lean manufacturing', 'Mechanical processes', 'protocols execution', 'Supervisory', 'System integration', 'Team player', 'Troubleshooting'] ['East Boston High School'] ['Diploma'] ['1999'] [None] [None] [None] ['Company Name', 'Company Name', 'Company Name', 'Company Name', 'Company Name', 'Company Name'] [None, None, None, None, None, None] ['April 2015', 'February 2015', 'February 2004', 'September 1999', 'April 2003', 'March 2001'] ['Current', 'April 2015', 'June 2014', 'January 2004', 'September 2003', 'January 2002'] [None, None, None, None, None, None] ['Engineering Technician', 'Sr. Repair Technician', 'Lead Manufacturing Technician Production Supervisor', 'Wafer Fab Technician', 'Assembler/Operator', 'Test Technician'] ['City , State', 'City , State', 'City , State', 'City , State', 'City , State', 'City , State'] nan nan nan nan nan nan nan nan nan nan nan"
97,"Computer Science Department University of Kentucky Lexington, KY 40506-0046",,,"['University of Warsaw', 'University of Warsaw']","['Ph.D.', 'M.S.']","['1980', '1977']","['N/A', 'N/A']","['N/A', 'N/A']","['Computer Science', 'Computer Science']","['University of Kentucky', 'University of Kentucky', 'University of Kentucky', 'University of Kentucky', 'Columbia University', 'Columbia University', 'Columbia University', 'University of Warsaw', 'University of Warsaw']","[None, None, None, None, None, None, None, None, None]","['2022', '1990', '1993', '1987', '1985', '1983', '1982', '1980', '1977']","['∞', '2022', '2007', '1990', '1987', '1985', '1983', '1982', '1980']","[None, None, None, None, None, None, None, None, None]","['Professor Emerytus', 'Professor', 'Director of Graduate Studies', 'Associate Professor', 'Associate Professor', 'Assistant Professor', 'Visiting Assistant Professor', 'Assistant Professor', 'Teaching and Research Assistant']","['Lexington, KY', 'Lexington, KY', 'Lexington, KY', 'Lexington, KY', 'New York, NY', 'New York, NY', 'New York, NY', 'Warsaw, Poland', 'Warsaw, Poland']",,,,,,,,,,,,"Computer Science Department University of Kentucky Lexington, KY 40506-0046 nan nan ['University of Warsaw', 'University of Warsaw'] ['Ph.D.', 'M.S.'] ['1980', '1977'] ['N/A', 'N/A'] ['N/A', 'N/A'] ['Computer Science', 'Computer Science'] ['University of Kentucky', 'University of Kentucky', 'University of Kentucky', 'University of Kentucky', 'Columbia University', 'Columbia University', 'Columbia University', 'University of Warsaw', 'University of Warsaw'] [None, None, None, None, None, None, None, None, None] ['2022', '1990', '1993', '1987', '1985', '1983', '1982', '1980', '1977'] ['∞', '2022', '2007', '1990', '1987', '1985', '1983', '1982', '1980'] [None, None, None, None, None, None, None, None, None] ['Professor Emerytus', 'Professor', 'Director of Graduate Studies', 'Associate Professor', 'Associate Professor', 'Assistant Professor', 'Visiting Assistant Professor', 'Assistant Professor', 'Teaching and Research Assistant'] ['Lexington, KY', 'Lexington, KY', 'Lexington, KY', 'Lexington, KY', 'New York, NY', 'New York, NY', 'New York, NY', 'Warsaw, Poland', 'Warsaw, Poland'] nan nan nan nan nan nan nan nan nan nan nan"
