resume_id,address,career_objective,skills,educational_institution_name,degree_names,passing_years,educational_results,result_types,major_field_of_studies,professional_company_names,company_urls,start_dates,end_dates,related_skils_in_job,positions,locations,extra_curricular_activity_types,extra_curricular_organization_names,extra_curricular_organization_links,role_positions,languages,proficiency_levels,certification_providers,certification_skills,online_links,issue_dates,expiry_dates,resume_text
167,,,"['Live Electrical', 'Arc Flash', 'Lock-Out/Tag-Out', 'ESD', 'functional testing', 'test equipment repair and operation', 'troubleshooting', 'ISO-9001 standards', 'electrical equipment operation', 'Mechanical repair', 'oil servicing', 'Power Generation', 'soldering', 'electrical component repair', 'safety awareness', 'schematics', 'blueprints', 'drawings', 'various testing equipment', 'equipment/wiring installation', 'solenoid/valves', 'PC repair', 'fabrication', 'well organized', 'self motivated', 'excellent written and verbal communication skills']","['Embry Riddle Aeronautical University', 'Pueblo High School']","['Bachelor of Science', 'Diploma']","['N/A', '1996']","['N/A', 'N/A']","['N/A', 'N/A']","['Professional Aeronautics', 'N/A']","['Company Name', 'Company Name', 'Company Name', 'Company Name']","[None, None, None, None]","['07/2013', '08/1999', '02/1998', '08/1996']","['Current', '07/2013', '08/1999', '08/1999']","[['Electrical Power Generation', 'Cabin Pressure', 'Fuel/Advance Controls and Sensors', 'Electronics', 'Environmental Labs'], ['Setup and perform functional acceptance testing', 'troubleshooting', 'safety representative'], ['airframe and power plant maintenance', 'engine proficiency', 'high-tech composite repair procedures'], ['troubleshooting', 'maintenance services', 'electrical power']]","['Engineering Technician III', 'Generator Test Technician III', 'Unmanned Aerial Vehicle (UAV) Maintenance Technician', 'Electrical Power Generation Equipment Repairer Technician']","['City , State', 'City , State', 'City , State', 'N/A']",,,,,,,['U.S. Army'],[None],[None],['1998'],[None],"nan nan ['Live Electrical', 'Arc Flash', 'Lock-Out/Tag-Out', 'ESD', 'functional testing', 'test equipment repair and operation', 'troubleshooting', 'ISO-9001 standards', 'electrical equipment operation', 'Mechanical repair', 'oil servicing', 'Power Generation', 'soldering', 'electrical component repair', 'safety awareness', 'schematics', 'blueprints', 'drawings', 'various testing equipment', 'equipment/wiring installation', 'solenoid/valves', 'PC repair', 'fabrication', 'well organized', 'self motivated', 'excellent written and verbal communication skills'] ['Embry Riddle Aeronautical University', 'Pueblo High School'] ['Bachelor of Science', 'Diploma'] ['N/A', '1996'] ['N/A', 'N/A'] ['N/A', 'N/A'] ['Professional Aeronautics', 'N/A'] ['Company Name', 'Company Name', 'Company Name', 'Company Name'] [None, None, None, None] ['07/2013', '08/1999', '02/1998', '08/1996'] ['Current', '07/2013', '08/1999', '08/1999'] [['Electrical Power Generation', 'Cabin Pressure', 'Fuel/Advance Controls and Sensors', 'Electronics', 'Environmental Labs'], ['Setup and perform functional acceptance testing', 'troubleshooting', 'safety representative'], ['airframe and power plant maintenance', 'engine proficiency', 'high-tech composite repair procedures'], ['troubleshooting', 'maintenance services', 'electrical power']] ['Engineering Technician III', 'Generator Test Technician III', 'Unmanned Aerial Vehicle (UAV) Maintenance Technician', 'Electrical Power Generation Equipment Repairer Technician'] ['City , State', 'City , State', 'City , State', 'N/A'] nan nan nan nan nan nan ['U.S. Army'] [None] [None] ['1998'] [None]"
168,,Adept at extracting and combining data from multiple sources to come up with KPIs which have a direct impact on the bottom line of a project.,"['Data Analysis', 'Data Visualization', 'Deep Learning', 'Machine Learning', 'Adobe Analytics', 'Excel', 'Matplotlib', 'Python']",['Maulana Abul University'],['B.tech'],['2019'],['N/A'],['N/A'],['IT'],['Tata Sons'],['N/A'],['Apr 2019'],['Till date'],"[['Data Analysis', 'Data Visualization', 'Business Intelligence']]",['Analyst Support'],['N/A'],,,,,,,,,,,,"nan Adept at extracting and combining data from multiple sources to come up with KPIs which have a direct impact on the bottom line of a project. ['Data Analysis', 'Data Visualization', 'Deep Learning', 'Machine Learning', 'Adobe Analytics', 'Excel', 'Matplotlib', 'Python'] ['Maulana Abul University'] ['B.tech'] ['2019'] ['N/A'] ['N/A'] ['IT'] ['Tata Sons'] ['N/A'] ['Apr 2019'] ['Till date'] [['Data Analysis', 'Data Visualization', 'Business Intelligence']] ['Analyst Support'] ['N/A'] nan nan nan nan nan nan nan nan nan nan nan"
169,,I am a market research specialist with a grasp of machine learning and looking for a deeper dive into the career of being a professional machine learning engineer.,"['Research Associate', 'Business Analyst', 'Business Analytics', 'Data Mining', 'Data Modeling', 'Predictive Analysis', 'Business Intelligence', 'Machine Learning', 'Market Research', 'Customer Engagement', 'Risk Management', 'Retention', 'Audience', 'Python']",['Bhavleesh Duggar College'],['B.Tech'],['2020'],['N/A'],['N/A'],['Mechanical'],['Kripa Infotech'],['N/A'],['Apr 2020'],['Sep 2020'],"[['Market Research', 'Data Analysis']]",['Associate Market Research Analyst Intern'],['N/A'],,,,,,,['N/A'],[['Python']],['N/A'],['N/A'],['N/A'],"nan I am a market research specialist with a grasp of machine learning and looking for a deeper dive into the career of being a professional machine learning engineer. ['Research Associate', 'Business Analyst', 'Business Analytics', 'Data Mining', 'Data Modeling', 'Predictive Analysis', 'Business Intelligence', 'Machine Learning', 'Market Research', 'Customer Engagement', 'Risk Management', 'Retention', 'Audience', 'Python'] ['Bhavleesh Duggar College'] ['B.Tech'] ['2020'] ['N/A'] ['N/A'] ['Mechanical'] ['Kripa Infotech'] ['N/A'] ['Apr 2020'] ['Sep 2020'] [['Market Research', 'Data Analysis']] ['Associate Market Research Analyst Intern'] ['N/A'] nan nan nan nan nan nan ['N/A'] [['Python']] ['N/A'] ['N/A'] ['N/A']"
170,,Data Engineer who is experienced with Text Analytics and Natural Language Processing. I have also worked on Big Data Analytics using hadoop,"['Machine learning', 'Data science', 'PowerBI', 'Data visualisation', 'Data Mining', 'Data Modelling', 'Data Extraction', 'Text Analysis', 'Natural Language Processing']",['JIoT Belemundi'],['B.Tech'],['2019'],['N/A'],['N/A'],['N/A'],['Invictus Qualis'],['N/A'],['Nov 2019'],['Till date'],"[['Big Data Analysis', 'Prediction', 'Residual Normality', 'knowledge-based results extraction']]",['N/A'],['N/A'],['Workshop'],['Dome Enterprises'],['N/A'],['N/A'],,,,,,,,"nan Data Engineer who is experienced with Text Analytics and Natural Language Processing. I have also worked on Big Data Analytics using hadoop ['Machine learning', 'Data science', 'PowerBI', 'Data visualisation', 'Data Mining', 'Data Modelling', 'Data Extraction', 'Text Analysis', 'Natural Language Processing'] ['JIoT Belemundi'] ['B.Tech'] ['2019'] ['N/A'] ['N/A'] ['N/A'] ['Invictus Qualis'] ['N/A'] ['Nov 2019'] ['Till date'] [['Big Data Analysis', 'Prediction', 'Residual Normality', 'knowledge-based results extraction']] ['N/A'] ['N/A'] ['Workshop'] ['Dome Enterprises'] ['N/A'] ['N/A'] nan nan nan nan nan nan nan"
171,,"Highly motivated mechanical engineering student (EIT) interested in pursuing an engaging position in the corporate setting to implement skills honed through years of engineering background. A dedicated student with problem-solving, leadership, and communication skills along with the capability to build relationships and work in a team-oriented environment.","['Academic', 'acrylic', 'AutoCAD', 'CAD', 'concept', 'Engineer-In-Training', 'EIT', 'estimating', 'drawing', 'graphics and design', 'Laser', 'Material Science', 'Microsoft Excel', 'Microsoft PowerPoint', 'Microsoft Word', 'design process', 'progress', 'Project management', 'proposals', 'Reporting', 'Research', 'robotics', 'safety', 'SolidWorks', 'Statistics', 'Time management', 'verbal communication skills', 'weighing', 'Written']","['University of California, City, State']",['Bachelor of Science'],[None],[None],[None],['Mechanical Engineering'],"['Company Name', 'Company Name']","[None, None]","['09/2015', '05/2014']","['Current', '03/2015']","[['SolidWorks', 'AutoCAD'], ['robotics', 'Research']]","['Mechanical Engineering Intern', 'Systems Engineering Intern']","['City, State', 'City, State']","['Volunteering', 'Academic mentoring']","['Dong Shin Presbyterian Church', 'El Toyon Elementary']","[None, None]","['Teaching Assistant', 'Academic mentor']",,,[None],[None],[None],['October 2015'],[None],"nan Highly motivated mechanical engineering student (EIT) interested in pursuing an engaging position in the corporate setting to implement skills honed through years of engineering background. A dedicated student with problem-solving, leadership, and communication skills along with the capability to build relationships and work in a team-oriented environment. ['Academic', 'acrylic', 'AutoCAD', 'CAD', 'concept', 'Engineer-In-Training', 'EIT', 'estimating', 'drawing', 'graphics and design', 'Laser', 'Material Science', 'Microsoft Excel', 'Microsoft PowerPoint', 'Microsoft Word', 'design process', 'progress', 'Project management', 'proposals', 'Reporting', 'Research', 'robotics', 'safety', 'SolidWorks', 'Statistics', 'Time management', 'verbal communication skills', 'weighing', 'Written'] ['University of California, City, State'] ['Bachelor of Science'] [None] [None] [None] ['Mechanical Engineering'] ['Company Name', 'Company Name'] [None, None] ['09/2015', '05/2014'] ['Current', '03/2015'] [['SolidWorks', 'AutoCAD'], ['robotics', 'Research']] ['Mechanical Engineering Intern', 'Systems Engineering Intern'] ['City, State', 'City, State'] ['Volunteering', 'Academic mentoring'] ['Dong Shin Presbyterian Church', 'El Toyon Elementary'] [None, None] ['Teaching Assistant', 'Academic mentor'] nan nan [None] [None] [None] ['October 2015'] [None]"
172,,I am a software developer currently working on Machine Learning Projects. The domain of analytics and Machine Learning has amassed a greater interest for me and I want to explore and learn about the core concepts used in production. I am looking to switch to a fulltime role that will help me explore more about this.,"['Statistical Modeling', 'Natural Language Processing', 'Text Mining', 'Python', 'PySpark', 'Microsoft Azure', 'Azure Databricks', 'Azure Data Factory', 'SQL', 'Machine Learning Engineer', 'Data Analyst']",['PRM College of Engineering'],['B.Tech'],['2019'],[None],[None],['Information Technology'],['Desarks'],[None],['Nov 2019'],['Ongoing'],"[['Natural Language Processing', 'Fraud Analytics', 'Network Analysis', 'Graphic Visualization']]",['Software Developer (Machine Learning)'],['N/A'],['Workshop'],['Software Lifecycle'],[None],[None],,,,,,,,"nan I am a software developer currently working on Machine Learning Projects. The domain of analytics and Machine Learning has amassed a greater interest for me and I want to explore and learn about the core concepts used in production. I am looking to switch to a fulltime role that will help me explore more about this. ['Statistical Modeling', 'Natural Language Processing', 'Text Mining', 'Python', 'PySpark', 'Microsoft Azure', 'Azure Databricks', 'Azure Data Factory', 'SQL', 'Machine Learning Engineer', 'Data Analyst'] ['PRM College of Engineering'] ['B.Tech'] ['2019'] [None] [None] ['Information Technology'] ['Desarks'] [None] ['Nov 2019'] ['Ongoing'] [['Natural Language Processing', 'Fraud Analytics', 'Network Analysis', 'Graphic Visualization']] ['Software Developer (Machine Learning)'] ['N/A'] ['Workshop'] ['Software Lifecycle'] [None] [None] nan nan nan nan nan nan nan"
173,,,"['Data Scientist', 'Data Analyst', 'Software Development', 'Machine Learning', 'Natural Language Processing', 'Business Solutions', 'Process Flow', 'Logistic Regression', 'MySQL', 'MongoDB', 'Python', 'PowerBI', 'Hadoop']","['Rajiv Gandhi Proudyogiki Vishwavidyalaya (RGPV), Bhopal']",['B.E. (Data Engineering)'],['2019'],['N/A'],['N/A'],['Data Engineering'],['United Health Group'],[None],['Jun 2019'],['Till Date'],"[['Machine Learning', 'Data Science']]",['Data Scientist'],['N/A'],['NLP Development'],['CALTECH'],[None],['NLP Developer'],,,,,,,,"nan nan ['Data Scientist', 'Data Analyst', 'Software Development', 'Machine Learning', 'Natural Language Processing', 'Business Solutions', 'Process Flow', 'Logistic Regression', 'MySQL', 'MongoDB', 'Python', 'PowerBI', 'Hadoop'] ['Rajiv Gandhi Proudyogiki Vishwavidyalaya (RGPV), Bhopal'] ['B.E. (Data Engineering)'] ['2019'] ['N/A'] ['N/A'] ['Data Engineering'] ['United Health Group'] [None] ['Jun 2019'] ['Till Date'] [['Machine Learning', 'Data Science']] ['Data Scientist'] ['N/A'] ['NLP Development'] ['CALTECH'] [None] ['NLP Developer'] nan nan nan nan nan nan nan"
174,,Fresher Data Engineer who is experienced in pipeline building and analytics. Seeking to leverage my technical and analytical skills to drive growth of the organization.,"['Data Engineer', 'Data Analytics', 'Data Visualization', 'Machine Learning', 'Statistical Modeling', 'Predictive Modeling', 'MongoDB', 'PowerBI', 'Tableau', 'Python', 'MySQL']","['Government College of Engineering, Pune', 'Great Lakes Institute of Management']","['B.Tech', 'PG Diploma']","['2019', '2021']","['N/A', 'N/A']","['N/A', 'N/A']","['Electronics and Communication', 'Data Science and Engineering']",['ZF Group'],['N/A'],['August 2020'],[None],"[['Cognos BI', 'Analytics', 'Dashboard Development']]",['Data Engineer Associate'],"['Hannover, Germany']",,,,,,,,,,,,"nan Fresher Data Engineer who is experienced in pipeline building and analytics. Seeking to leverage my technical and analytical skills to drive growth of the organization. ['Data Engineer', 'Data Analytics', 'Data Visualization', 'Machine Learning', 'Statistical Modeling', 'Predictive Modeling', 'MongoDB', 'PowerBI', 'Tableau', 'Python', 'MySQL'] ['Government College of Engineering, Pune', 'Great Lakes Institute of Management'] ['B.Tech', 'PG Diploma'] ['2019', '2021'] ['N/A', 'N/A'] ['N/A', 'N/A'] ['Electronics and Communication', 'Data Science and Engineering'] ['ZF Group'] ['N/A'] ['August 2020'] [None] [['Cognos BI', 'Analytics', 'Dashboard Development']] ['Data Engineer Associate'] ['Hannover, Germany'] nan nan nan nan nan nan nan nan nan nan nan"
175,,,"['New Business Development', 'Sales Management', 'MS Office Suite', 'Salesforce / CRM']","['Western Governors University', 'University of Phoenix', 'Oklahoma Baptist University']","['Masters of Business Administration', 'Bachelors of Science', 'N/A']","['2013', '2011', 'N/A']","['N/A', 'N/A', 'N/A']","['N/A', 'N/A', 'N/A']","['Business Strategy', 'Business Management', 'Biology/Pre-Medicine']","['Company Name', 'Company Name', 'Company Name', 'Company Name', 'Company Name', 'Company Name', 'Company Name', 'Company Name', 'Company Name']","[None, None, None, None, None, None, None, None, None]","['06/2014', '06/2014', '07/2014', '08/2011', '06/2009', '12/2007', '01/2004', '03/1999', '04/1996']","['Current', 'Current', 'Current', '06/2014', '08/2011', '08/2009', '11/2007', '02/2004', '03/1999']","[['sales', 'budget forecasting', 'goal setting', 'performance reporting', 'strategic partnerships'], ['sales', 'networking', 'content marketing', 'market information'], ['industry validation', 'product management', 'sales strategy'], ['process implementation', 'strategic partnerships', 'business planning'], ['sales management', 'team training', 'report generation'], ['strategic planning', 'presentation', 'network development'], ['sales', 'customer relations', 'complaint resolution'], ['entrepreneurship', 'contract negotiation', 'staff training'], ['sales expansion', 'staff recruitment', 'inventory management']]","['Director of Business Development', 'Director of Business Development', 'Director of Business Development', 'Director of Sales Operations and Business Development', 'Sales Director', 'Regional Publishing Consultant', 'Senior Sales Representative', 'Owner', 'Branch Manager']","['City , State', 'City , State', 'City , State', 'City , State', 'City , State', 'City , State', 'City , State', 'City , State', 'City , State']",,,,,,,,,,,,"nan nan ['New Business Development', 'Sales Management', 'MS Office Suite', 'Salesforce / CRM'] ['Western Governors University', 'University of Phoenix', 'Oklahoma Baptist University'] ['Masters of Business Administration', 'Bachelors of Science', 'N/A'] ['2013', '2011', 'N/A'] ['N/A', 'N/A', 'N/A'] ['N/A', 'N/A', 'N/A'] ['Business Strategy', 'Business Management', 'Biology/Pre-Medicine'] ['Company Name', 'Company Name', 'Company Name', 'Company Name', 'Company Name', 'Company Name', 'Company Name', 'Company Name', 'Company Name'] [None, None, None, None, None, None, None, None, None] ['06/2014', '06/2014', '07/2014', '08/2011', '06/2009', '12/2007', '01/2004', '03/1999', '04/1996'] ['Current', 'Current', 'Current', '06/2014', '08/2011', '08/2009', '11/2007', '02/2004', '03/1999'] [['sales', 'budget forecasting', 'goal setting', 'performance reporting', 'strategic partnerships'], ['sales', 'networking', 'content marketing', 'market information'], ['industry validation', 'product management', 'sales strategy'], ['process implementation', 'strategic partnerships', 'business planning'], ['sales management', 'team training', 'report generation'], ['strategic planning', 'presentation', 'network development'], ['sales', 'customer relations', 'complaint resolution'], ['entrepreneurship', 'contract negotiation', 'staff training'], ['sales expansion', 'staff recruitment', 'inventory management']] ['Director of Business Development', 'Director of Business Development', 'Director of Business Development', 'Director of Sales Operations and Business Development', 'Sales Director', 'Regional Publishing Consultant', 'Senior Sales Representative', 'Owner', 'Branch Manager'] ['City , State', 'City , State', 'City , State', 'City , State', 'City , State', 'City , State', 'City , State', 'City , State', 'City , State'] nan nan nan nan nan nan nan nan nan nan nan"
176,,"Associate Solution Advisor currently enrolled in PG for Data science, Knowledge in data manipulation, analysis, reporting and data visualization. In depth knowledge of tools used for production.","['Machine Learning', 'Data Analysis', 'Data Visualization', 'Risk Assessment', 'Debugging', 'Database Management', 'Access Control', 'IAM', 'Sail point', 'Java', 'Python', 'MySQL', 'MongoDB', 'Data Structures']","['Jyothi Institute of Engineering & Technology, Hyderabad']",['B.E. (Computers)'],['2019'],['N/A'],['N/A'],['Computers'],['Delta Info-nancial Services'],['N/A'],['Jun 2019'],['Ongoing'],"[['IAM solutions', 'SailPoint', 'Java', 'security alerts', 'requirements gathering', 'design & development']]",['SDE for Software Caging'],['N/A'],,,,,,,['Microsoft Technology Associate'],[['Software Fundamentals']],[None],['N/A'],[None],"nan Associate Solution Advisor currently enrolled in PG for Data science, Knowledge in data manipulation, analysis, reporting and data visualization. In depth knowledge of tools used for production. ['Machine Learning', 'Data Analysis', 'Data Visualization', 'Risk Assessment', 'Debugging', 'Database Management', 'Access Control', 'IAM', 'Sail point', 'Java', 'Python', 'MySQL', 'MongoDB', 'Data Structures'] ['Jyothi Institute of Engineering & Technology, Hyderabad'] ['B.E. (Computers)'] ['2019'] ['N/A'] ['N/A'] ['Computers'] ['Delta Info-nancial Services'] ['N/A'] ['Jun 2019'] ['Ongoing'] [['IAM solutions', 'SailPoint', 'Java', 'security alerts', 'requirements gathering', 'design & development']] ['SDE for Software Caging'] ['N/A'] nan nan nan nan nan nan ['Microsoft Technology Associate'] [['Software Fundamentals']] [None] ['N/A'] [None]"
177,,"To advance in professional and personal experiences within Finance, Tax Accounting and Management To obtain a Staff Accountant position that will enable me to perform my best using my mathematical, numerical, accounting and analytical ability for the betterment of the organization.","['Microsoft applications', 'Excellent writing skills', 'Research support', 'Analytical skills', 'Accounting', 'billing', 'C programming', 'closing', 'consultant', 'Consulting', 'credit', 'Client', 'clients', 'customer care', 'data entry', 'database', 'debit', 'delivery', 'documentation', 'editing', 'Senior Management', 'fetch', 'filing', 'Financial', 'Forms', 'Full Life Cycle', 'funds', 'General Ledger accounts', 'legal', 'managing', 'Excel', 'office', 'Windows', 'Microsoft Word', 'month-end closing', 'Oracle', 'Oracle database', 'Designer 2000', 'Developer', 'OS/2', 'processing payments', 'policies', 'processes', 'proposals', 'Quality assurance', 'read', 'real estate', 'reporting', 'requirement', 'Sales', 'scheduling', 'scripts', 'Solomon', 'SQL', 'System Integration', 'tables', 'Tax accounting', 'Tax', 'tax returns', 'Technical documentation', 'telephone', 'upgrades', 'utilities']","['Kings College', 'South Carolina State University']","['Diploma', 'Bachelor of Science']","['2004', '1995']","[None, None]","[None, None]","['Accounting', 'Computer Science']","['Company Name', 'Company Name', 'Company Name', 'Company Name', 'Company Name']","[None, None, None, None, None]","['04/2006', '06/2004', '09/2002', '04/1998', '06/1996']","['09/2016', '04/2006', '04/2003', '05/2001', '04/1998']","[['tax management', 'communication', 'accounting'], ['financial management', 'account reconciliations', 'tax preparation', 'policy compliance'], ['customer support', 'real estate communications', 'time management'], ['software support', 'system development', 'client consultation'], ['software development', 'technical documentation', 'client communication']]","['Staff Accountant', 'Financial Aid Accounting Administrator', 'Customer Care Consultant', 'Computer Programmer', 'Computer Programmer Analyst']","['City , State', 'City , State', 'City , State', 'City , State', 'City , State']",,,,,,,,,,,,"nan To advance in professional and personal experiences within Finance, Tax Accounting and Management To obtain a Staff Accountant position that will enable me to perform my best using my mathematical, numerical, accounting and analytical ability for the betterment of the organization. ['Microsoft applications', 'Excellent writing skills', 'Research support', 'Analytical skills', 'Accounting', 'billing', 'C programming', 'closing', 'consultant', 'Consulting', 'credit', 'Client', 'clients', 'customer care', 'data entry', 'database', 'debit', 'delivery', 'documentation', 'editing', 'Senior Management', 'fetch', 'filing', 'Financial', 'Forms', 'Full Life Cycle', 'funds', 'General Ledger accounts', 'legal', 'managing', 'Excel', 'office', 'Windows', 'Microsoft Word', 'month-end closing', 'Oracle', 'Oracle database', 'Designer 2000', 'Developer', 'OS/2', 'processing payments', 'policies', 'processes', 'proposals', 'Quality assurance', 'read', 'real estate', 'reporting', 'requirement', 'Sales', 'scheduling', 'scripts', 'Solomon', 'SQL', 'System Integration', 'tables', 'Tax accounting', 'Tax', 'tax returns', 'Technical documentation', 'telephone', 'upgrades', 'utilities'] ['Kings College', 'South Carolina State University'] ['Diploma', 'Bachelor of Science'] ['2004', '1995'] [None, None] [None, None] ['Accounting', 'Computer Science'] ['Company Name', 'Company Name', 'Company Name', 'Company Name', 'Company Name'] [None, None, None, None, None] ['04/2006', '06/2004', '09/2002', '04/1998', '06/1996'] ['09/2016', '04/2006', '04/2003', '05/2001', '04/1998'] [['tax management', 'communication', 'accounting'], ['financial management', 'account reconciliations', 'tax preparation', 'policy compliance'], ['customer support', 'real estate communications', 'time management'], ['software support', 'system development', 'client consultation'], ['software development', 'technical documentation', 'client communication']] ['Staff Accountant', 'Financial Aid Accounting Administrator', 'Customer Care Consultant', 'Computer Programmer', 'Computer Programmer Analyst'] ['City , State', 'City , State', 'City , State', 'City , State', 'City , State'] nan nan nan nan nan nan nan nan nan nan nan"
